<?xml version="1.0" encoding="UTF-8"?>
<?xml-stylesheet href="books.xsl" type="text/xsl"?>

<books xmlns:xsi="http://www.w3.org/2001/XMLSchema-instance"
        xsi:noNamespaceSchemaLocation="books.xsd">
    <book id="1">
        <title>The Great Gatsby</title>
        <author>F. Scott Fitzgerald</author>
        <genre>Fiction</genre>
        <price>15.99</price>
        <publicationDate>1925-04-10</publicationDate>
        <coverImage>images/gatsby.jpg</coverImage>
        <description>Một câu chuyện về tình yêu và bi kịch trong thập niên 1920.</description>
    </book>
    <book id="2">
        <title>The Hobbit</title>
        <author>J.R.R. Tolkien</author>
        <genre>Fantasy</genre>
        <price>25.50</price>
        <publicationDate>1937-09-21</publicationDate>
        <coverImage>images/hobbit.jpg</coverImage>
        <description>This is a fascinating book that takes readers on an unforgettable journey through time, space, and imagination, exploring themes of love, loss, and the human spirit in extraordinary ways.
        </description>
    </book>
</books>
